-- Rolled-back writes vanish, which chapter 16 could not show.
CREATE TABLE t (a int4 PRIMARY KEY, b text);
INSERT INTO t VALUES (1, 'one'), (2, 'two');
BEGIN;
INSERT INTO t VALUES (3, 'three');
SELECT * FROM t ORDER BY a;
 a |   b   
---+-------
 1 | one
 2 | two
 3 | three
(3 rows)

ROLLBACK;
SELECT * FROM t ORDER BY a;
 a |  b  
---+-----
 1 | one
 2 | two
(2 rows)

BEGIN;
DELETE FROM t WHERE a = 1;
UPDATE t SET b = 'zwei' WHERE a = 2;
SELECT * FROM t ORDER BY a;
 a |  b   
---+------
 2 | zwei
(1 row)

ROLLBACK;
SELECT * FROM t ORDER BY a;
 a |  b  
---+-----
 1 | one
 2 | two
(2 rows)

SELECT b FROM t WHERE a = 2;
  b  
-----
 two
(1 row)

-- A failed statement in a block is rolled back with the block.
BEGIN;
INSERT INTO t VALUES (3, 'three');
INSERT INTO t VALUES (1, 'dup');
ERROR:  duplicate key value violates unique constraint "t_pkey"
COMMIT;
SELECT * FROM t ORDER BY a;
 a |  b  
---+-----
 1 | one
 2 | two
(2 rows)

-- A key freed by a delete in the same transaction can be reused; the
-- old tuple's index entry points at a dead row.
BEGIN;
DELETE FROM t WHERE a = 1;
INSERT INTO t VALUES (1, 'uno');
COMMIT;
SELECT * FROM t ORDER BY a;
 a |  b  
---+-----
 1 | uno
 2 | two
(2 rows)

SELECT b FROM t WHERE a = 1;
  b  
-----
 uno
(1 row)

-- Isolation levels.
BEGIN ISOLATION LEVEL REPEATABLE READ;
SELECT * FROM t ORDER BY a;
 a |  b  
---+-----
 1 | uno
 2 | two
(2 rows)

COMMIT;
BEGIN ISOLATION LEVEL READ COMMITTED;
COMMIT;
-- Rolled-back DDL: the table never existed, and the name is free.
BEGIN;
CREATE TABLE u (a int4);
INSERT INTO u VALUES (1);
SELECT * FROM u;
 a 
---
 1
(1 row)

ROLLBACK;
SELECT * FROM u;
ERROR:  relation "u" does not exist
LINE 1: SELECT * FROM u;
                      ^
CREATE TABLE u (a int4 PRIMARY KEY);
INSERT INTO u VALUES (2);
SELECT * FROM u;
 a 
---
 2
(1 row)

-- A rolled-back DROP TABLE keeps the table and its rows.
BEGIN;
DROP TABLE t;
SELECT * FROM t;
ERROR:  relation "t" does not exist
LINE 1: SELECT * FROM t;
                      ^
ROLLBACK;
SELECT * FROM t ORDER BY a;
 a |  b  
---+-----
 1 | uno
 2 | two
(2 rows)

-- An index built after a rollback covers the live rows only.
BEGIN;
INSERT INTO t VALUES (4, 'four');
ROLLBACK;
CREATE INDEX t_b ON t (b);
SELECT a FROM t WHERE b = 'four';
 a 
---
(0 rows)

SELECT a FROM t WHERE b = 'uno';
 a 
---
 1
(1 row)

ANALYZE t;
SELECT reltuples FROM pg_class WHERE relname = 't';
 reltuples 
-----------
         2
(1 row)

